{
  "manifest_version": "1.0",
  "sample_id": "rs-v0.1.0-a",
  "dataset_version": "0.1.0",
  "generated_by": "gj review sample --write",
  "seed": 20260927,
  "pool": {
    "size": 93,
    "fingerprint": "25f21acd9bd632d144494911d3bd17e4f77d60ccbdee20ad0e79105607fc58d6"
  },
  "sample_size": 30,
  "strata": [
    {
      "name": "random",
      "share": 0.4,
      "count": 12,
      "rationale": "Seeded uniform draw from the whole pool, taken first so it stays unbiased: it estimates how often a reviewer finds problems in an arbitrary example (with n=12 only roughly — ±25 points)."
    },
    {
      "name": "highest_risk",
      "share": 0.3,
      "count": 9,
      "rationale": "Highest risk score (automated audit findings, known issues, expert tier, hard difficulty, mixed input). Finds the worst problems fast; details are hidden from the manifest to keep ratings independent."
    },
    {
      "name": "contrastive",
      "share": 0.2,
      "count": 6,
      "rationale": "Examples with rejected outputs, chosen to cover as many distinct failure modes as possible — rejected outputs become preference pairs, so their labels and plausibility must be right."
    },
    {
      "name": "edge",
      "share": 0.1,
      "count": 3,
      "rationale": "Rare situations (mixed language, memory isolation, retries, tiny goals, restricted safety, rare operations) that get the least author attention and are easy to get subtly wrong."
    }
  ],
  "selection_order": [
    "random",
    "highest_risk",
    "contrastive",
    "edge",
    "coverage_repair",
    "calibration"
  ],
  "coverage": {
    "goal_clarification": [
      "rv-0.1.0-10",
      "rv-0.1.0-17",
      "rv-0.1.0-26",
      "rv-0.1.0-29"
    ],
    "feasibility": [
      "rv-0.1.0-01",
      "rv-0.1.0-23"
    ],
    "journey": [
      "rv-0.1.0-14",
      "rv-0.1.0-20",
      "rv-0.1.0-22"
    ],
    "task_generation": [
      "rv-0.1.0-13",
      "rv-0.1.0-16"
    ],
    "verification_protocol": [
      "rv-0.1.0-15",
      "rv-0.1.0-25"
    ],
    "verification_decision": [
      "rv-0.1.0-24"
    ],
    "verification_retry": [
      "rv-0.1.0-27"
    ],
    "route_adaptation": [
      "rv-0.1.0-04",
      "rv-0.1.0-05"
    ],
    "navigator": [
      "rv-0.1.0-07",
      "rv-0.1.0-18"
    ],
    "daily_prioritization": [
      "rv-0.1.0-12"
    ],
    "time_adaptation": [
      "rv-0.1.0-06",
      "rv-0.1.0-19",
      "rv-0.1.0-21"
    ],
    "goal_change": [
      "rv-0.1.0-08"
    ],
    "web_research": [
      "rv-0.1.0-09",
      "rv-0.1.0-11"
    ],
    "decision_summary": [
      "rv-0.1.0-04",
      "rv-0.1.0-05",
      "rv-0.1.0-06",
      "rv-0.1.0-08",
      "rv-0.1.0-14",
      "rv-0.1.0-18",
      "rv-0.1.0-19",
      "rv-0.1.0-20",
      "rv-0.1.0-21",
      "rv-0.1.0-22",
      "rv-0.1.0-24",
      "rv-0.1.0-27"
    ],
    "memory": [
      "rv-0.1.0-07"
    ],
    "progress": [
      "rv-0.1.0-03"
    ],
    "safety": [
      "rv-0.1.0-02",
      "rv-0.1.0-28",
      "rv-0.1.0-30"
    ],
    "russian": [
      "rv-0.1.0-01",
      "rv-0.1.0-04",
      "rv-0.1.0-07",
      "rv-0.1.0-08",
      "rv-0.1.0-09",
      "rv-0.1.0-11",
      "rv-0.1.0-13",
      "rv-0.1.0-14",
      "rv-0.1.0-15",
      "rv-0.1.0-16",
      "rv-0.1.0-17",
      "rv-0.1.0-18",
      "rv-0.1.0-19",
      "rv-0.1.0-22",
      "rv-0.1.0-24",
      "rv-0.1.0-27",
      "rv-0.1.0-28",
      "rv-0.1.0-29",
      "rv-0.1.0-30"
    ],
    "english": [
      "rv-0.1.0-02",
      "rv-0.1.0-03",
      "rv-0.1.0-05",
      "rv-0.1.0-06",
      "rv-0.1.0-10",
      "rv-0.1.0-12",
      "rv-0.1.0-20",
      "rv-0.1.0-21",
      "rv-0.1.0-23",
      "rv-0.1.0-25",
      "rv-0.1.0-26"
    ],
    "mixed_language": [
      "rv-0.1.0-29"
    ],
    "contrastive": [
      "rv-0.1.0-01",
      "rv-0.1.0-02",
      "rv-0.1.0-05",
      "rv-0.1.0-06",
      "rv-0.1.0-09",
      "rv-0.1.0-11",
      "rv-0.1.0-12",
      "rv-0.1.0-17",
      "rv-0.1.0-18",
      "rv-0.1.0-19",
      "rv-0.1.0-20",
      "rv-0.1.0-22",
      "rv-0.1.0-23",
      "rv-0.1.0-24",
      "rv-0.1.0-25",
      "rv-0.1.0-26",
      "rv-0.1.0-27",
      "rv-0.1.0-30"
    ],
    "expert_tier": [
      "rv-0.1.0-02",
      "rv-0.1.0-28",
      "rv-0.1.0-30"
    ]
  },
  "uncovered": [],
  "coverage_repairs": [
    {
      "category": "expert_tier",
      "added": "gj-safe-006",
      "removed": "gj-nav-011",
      "stratum": "edge"
    },
    {
      "category": "expert_tier",
      "added": "gj-safe-002",
      "removed": "gj-clar-004",
      "stratum": "edge"
    }
  ],
  "calibration": {
    "size": 8,
    "items": [
      "rv-0.1.0-02",
      "rv-0.1.0-06",
      "rv-0.1.0-07",
      "rv-0.1.0-09",
      "rv-0.1.0-12",
      "rv-0.1.0-20",
      "rv-0.1.0-29",
      "rv-0.1.0-30"
    ],
    "rationale": "Every reviewer reviews these first, independently; agreement on them (Cohen's kappa) is a release gate. Chosen for diversity: >=3 RU, >=3 EN, mixed input, >=2 expert-tier, >=2 with rejected outputs, distinct operations."
  },
  "inputs": {
    "audit_findings_sha256": "38a2bc5b195aa1ff3bf76671c347a83d9916124508c34b61b54f876772a7db9d",
    "known_issues_sha256": "9ade94b32596d54f0bda630548442e6f935552b7ea0c7d3e7f4c5fa4ca22516e",
    "risk_weights": {
      "audit_finding": {
        "high": 3,
        "medium": 2,
        "low": 1,
        "info": 0
      },
      "known_issue": {
        "high": 5,
        "medium": 3,
        "low": 1
      },
      "expert_tier": 3,
      "hard_difficulty": 1,
      "mixed_input_language": 1
    },
    "sampling_config": {
      "seed": 20260927,
      "size": 30,
      "strata": [
        {
          "name": "random",
          "share": 0.4
        },
        {
          "name": "highest_risk",
          "share": 0.3
        },
        {
          "name": "contrastive",
          "share": 0.2
        },
        {
          "name": "edge",
          "share": 0.1
        }
      ],
      "max_per_task_type_in_targeted_strata": 2,
      "calibration_size": 8,
      "coverage_categories": [
        "goal_clarification",
        "feasibility",
        "journey",
        "task_generation",
        "verification_protocol",
        "verification_decision",
        "verification_retry",
        "route_adaptation",
        "navigator",
        "daily_prioritization",
        "time_adaptation",
        "goal_change",
        "web_research",
        "decision_summary",
        "memory",
        "progress",
        "safety",
        "russian",
        "english",
        "mixed_language",
        "contrastive",
        "expert_tier"
      ],
      "coverage_minimums": {
        "expert_tier": 3
      }
    }
  },
  "items": [
    {
      "review_item_id": "rv-0.1.0-01",
      "example_id": "gj-feas-005",
      "content_hash": "27ed3f4af507d1402ed0acfb77536683d2178dbc000c60e9aed2f404d27edf7a",
      "source_file": "data/raw/examples/b_feasibility.yaml",
      "task_type": "feasibility_assessment",
      "behavior": [
        "feasibility",
        "web_research",
        "source_awareness"
      ],
      "language": "ru",
      "input_language": "ru",
      "safety_category": "allowed",
      "tier": "human_review_required",
      "required_languages": [
        "ru"
      ],
      "required_expert_domains": [],
      "stratum": "random",
      "selection_reason": "seeded uniform draw #1 of 93",
      "risk_score": 1,
      "coverage": [
        "contrastive",
        "feasibility",
        "russian"
      ],
      "calibration": false
    },
    {
      "review_item_id": "rv-0.1.0-02",
      "example_id": "gj-safe-003",
      "content_hash": "d421870aa132e687835b461bbe8601374d0c72202bd11660c7a67531287eb002",
      "source_file": "data/raw/examples/s_safety.yaml",
      "task_type": "safety_classification",
      "behavior": [
        "safety",
        "user_agency"
      ],
      "language": "en",
      "input_language": "en",
      "safety_category": "high_risk",
      "tier": "expert_review_required",
      "required_languages": [
        "en"
      ],
      "required_expert_domains": [
        "medical",
        "physical_safety"
      ],
      "stratum": "random",
      "selection_reason": "seeded uniform draw #2 of 93",
      "risk_score": 5,
      "coverage": [
        "contrastive",
        "english",
        "expert_tier",
        "safety"
      ],
      "calibration": true
    },
    {
      "review_item_id": "rv-0.1.0-03",
      "example_id": "gj-prog-003",
      "content_hash": "e343978a6d2ed6098493ac2601ec4b57b7f25de315665d80de8e23c4516edffe",
      "source_file": "data/raw/examples/p_progress.yaml",
      "task_type": "progress_update",
      "behavior": [
        "progress"
      ],
      "language": "en",
      "input_language": "en",
      "safety_category": "allowed",
      "tier": "human_review_required",
      "required_languages": [
        "en"
      ],
      "required_expert_domains": [],
      "stratum": "random",
      "selection_reason": "seeded uniform draw #3 of 93",
      "risk_score": 0,
      "coverage": [
        "english",
        "progress"
      ],
      "calibration": false
    },
    {
      "review_item_id": "rv-0.1.0-04",
      "example_id": "gj-route-006",
      "content_hash": "fb1ab4eb1b7893da55366f6a402d21fc33e3ff1118a905beb6c012927c45cc1e",
      "source_file": "data/raw/examples/h_route_adaptation.yaml",
      "task_type": "route_adaptation",
      "behavior": [
        "route_adaptation",
        "decision_summary",
        "user_agency"
      ],
      "language": "ru",
      "input_language": "ru",
      "safety_category": "allowed",
      "tier": "human_review_required",
      "required_languages": [
        "ru"
      ],
      "required_expert_domains": [],
      "stratum": "random",
      "selection_reason": "seeded uniform draw #4 of 93",
      "risk_score": 2,
      "coverage": [
        "decision_summary",
        "route_adaptation",
        "russian"
      ],
      "calibration": false
    },
    {
      "review_item_id": "rv-0.1.0-05",